{
  "schema_version": 1,
  "harness_id": "harness-000001",
  "content_hash": "sha256:0f3a1c9be2d47a5c88e01b6f4d2a9c7e5b3d8f1a0c6e4b2d9f7a5c3e1b8d6f4a",
  "created_at": "2026-07-23T09:00:00Z",
  "status": "candidate",
  "scope": {
    "task_types": ["repository_debugging"],
    "models": [],
    "repositories": ["context_runtime"]
  },
  "dimensions": {
    "context": {
      "manifest_policy": "task_declared",
      "max_context_tokens": 32000,
      "compression": false
    },
    "tools": {
      "allowed": ["shell", "grafos"],
      "retrieval_top_k": 5,
      "retry_policy": "bounded"
    },
    "generation": {
      "temperature": 0.1,
      "max_output_tokens": 8000
    },
    "orchestration": {
      "workflow": "plan_execute_verify",
      "max_steps": 12
    },
    "memory": {
      "retrieve_successes": 3,
      "retrieve_failures": 2,
      "include_global_patterns": true
    },
    "output": {
      "require_schema": false,
      "require_declared_checks": true,
      "fallback": "human_review"
    }
  }
}
