{
  "schema_version": 1,
  "harness_id": "harness-000017",
  "content_hash": "sha256:7d2e9b4f6a1c8e3b5d0f2a7c9e4b6d8f1a3c5e7b9d2f4a6c8e0b3d5f7a9c1e4b",
  "parent_harness_id": "harness-000012",
  "created_at": "2026-07-23T10:30:00Z",
  "status": "candidate",
  "scope": {
    "task_types": ["repository_debugging", "bounded_implementation"],
    "models": ["anthropic/claude-sonnet-5"],
    "repositories": []
  },
  "dimensions": {
    "context": {
      "manifest_policy": "task_declared_plus_retrieval",
      "max_context_tokens": 32000,
      "compression": false
    },
    "tools": {
      "allowed": ["shell", "grafos"],
      "retrieval_top_k": 5,
      "retry_policy": "bounded"
    },
    "generation": {
      "temperature": 0.1,
      "max_output_tokens": 8000
    },
    "orchestration": {
      "workflow": "plan_execute_verify",
      "max_steps": 12
    },
    "memory": {
      "retrieve_successes": 3,
      "retrieve_failures": 2,
      "include_global_patterns": true
    },
    "output": {
      "require_schema": false,
      "require_declared_checks": true,
      "fallback": "human_review"
    }
  },
  "evidence": {
    "supporting_patterns": ["PAT-004", "PAT-011"],
    "evaluation_id": "EVAL-0009"
  }
}
